{
  "$schema": "https://json-schema.org/draft/2020-12/schema",
  "$id": "https://openea.example/schema/changeset.schema.json",
  "title": "OpenEA Graph ChangeSet",
  "type": "object",
  "required": ["uri", "status", "operations"],
  "properties": {
    "uri": { "type": "string", "format": "uri" },
    "status": { "enum": ["proposed", "approved", "rejected", "applied"] },
    "createdBy": { "type": "string" },
    "createdAt": { "type": "string", "format": "date-time" },
    "sourceReferences": { "type": "array", "items": { "type": "string" } },
    "confidence": { "type": "number", "minimum": 0, "maximum": 1 },
    "operations": {
      "type": "array",
      "minItems": 1,
      "items": {
        "type": "object",
        "required": ["operation"],
        "properties": {
          "operation": {
            "enum": ["createResource", "updateResource", "deleteResource", "createRelationship", "updateRelationship", "deleteRelationship"]
          },
          "resource": { "type": "object" },
          "relationship": { "type": "object" },
          "uri": { "type": "string", "format": "uri" },
          "patch": { "type": "object" }
        },
        "additionalProperties": false
      }
    }
  },
  "additionalProperties": false
}
